{"schemaVersion":2,"result":"passed","failurePhase":null,"ci":{"provider":"github-actions","repository":"Future00111/ledgerpoint","workflow":"Ledgerly canonical PostgreSQL qualification","workflowRef":"Future00111/ledgerpoint/.github/workflows/ledgerly-canonical-postgresql.yml@refs/heads/main","runId":"38621069723","runAttempt":"1","job":"canonical-postgresql","workflowSourceCommit":"706dc6a31f85733ba0c251f40b2c09f5a9312269","implementationSourceCommit":"787d76decfa345e3c1104231e08d5ab00bc90259","identityMode":"activated","sourceRef":"refs/heads/main","refProtected":true,"ancestryVerified":true,"workflowCheckoutClean":true,"implementationCheckoutClean":true},"images":{"postgres":{"tag":"postgres:16.15-bookworm","digest":"sha256:bb3e1a57e5407e0a5280b4211980a5e537f4abd234a87014ac979849a78dd825"},"node":{"tag":"node:24.13.0-bookworm-slim","digest":"sha256:4660b1ca8b28d6d1906fd644abe34b2ed81d15434d26d845ef0aced307cf4b6f"},"postgresServerVersion":"16.15 (Debian 16.15-1.pgdg12+2)","nodeRuntimeVersion":"24.13.0","pnpmVersion":"10.26.1"},"binding":{"runUuid":"283124e1-47d4-4754-ae97-e0f59c2f579e","databaseName":"ledgerly_canonical_test_283124e147d44754ae97e0f59c2f579e","environment":"external-ci-disposable-test","targetClassification":"external-ci-postgresql-service-container","creatorIdentity":"postgres","runtimeIdentity":"ledgerly_api","identityMode":"activated","ciSourceRef":"refs/heads/main","ciRefProtected":true,"workflowSourceCommit":"706dc6a31f85733ba0c251f40b2c09f5a9312269","implementationSourceCommit":"787d76decfa345e3c1104231e08d5ab00bc90259","ancestryVerified":true,"workflowCheckoutClean":true,"implementationCheckoutClean":true,"sourceTreeSha256":"fcd81d162cbfc406853bdd13c853cd49f81fd814622a7f90116724e668eb82d1","nonceSha256":"27c8a1fe756842bc5e1213ca4519a7e587465eae3a9396efbee79d73dc0954a0","sourceDigests":{"sourceTree":"fcd81d162cbfc406853bdd13c853cd49f81fd814622a7f90116724e668eb82d1","applicationSchema":"67c2c27243abcdd35c1e6c5e3fa78fc7f537dce914677a8ef799ba1eb116f564","drizzleConfig":"57862221556f24a1accd28b283876930c403ad7c86b79d87cfb5c9c200ba6258","securityOverlay":"779d76aa3ab065d5bb1f5a08c9ea807cf4bc3166d0fdc1b59c21c81140404081","runControlSql":"cf7c294738f2400e5ce5ab7abcb1cc111bd8100a62386d075306ced6395bf00b","coordinator":"224275124927ffabc03a0720acb67bd4b2d3e99db8183d1c2eca4283e7440427","testSources":"2573b8b7be50acaadc68be89c6de53dbdb9279132455dac99fa02206bca916ac","lockfile":"3b8329fff64eab80ec5dfe8d875f80502789520faea4680d2fd0e7f0b4703f1b","workflow":"ad06da35f4269fbbf46e1fd4ccabf6082d309963e39b577e17ac948c546afc20","orchestrator":"3699a2ad28b5d2e3e652529c2d26bec8b7c84b7ff658fa8a08b4ae6f456ef54b"}},"bootstrap":{"status":"passed","roleSeparation":[{"name":"ledgerly_api","login":true,"superuser":false,"inherit":false,"createDatabase":false,"createRole":false,"replication":false,"bypassRls":false},{"name":"ledgerly_canonical_owner","login":false,"superuser":false,"inherit":false,"createDatabase":false,"createRole":false,"replication":false,"bypassRls":false},{"name":"postgres","login":true,"superuser":true,"inherit":true,"createDatabase":true,"createRole":true,"replication":true,"bypassRls":true}],"ownership":[{"table":"accounting_audit_events","owner":"ledgerly_canonical_owner","acl":"{ledgerly_canonical_owner=arwdDxt/ledgerly_canonical_owner,ledgerly_api=ar/ledgerly_canonical_owner}"},{"table":"accounting_posting_effects","owner":"ledgerly_canonical_owner","acl":"{ledgerly_canonical_owner=arwdDxt/ledgerly_canonical_owner,ledgerly_api=arw/ledgerly_canonical_owner}"},{"table":"canonical_journal_entries","owner":"ledgerly_canonical_owner","acl":"{ledgerly_canonical_owner=arwdDxt/ledgerly_canonical_owner,ledgerly_api=ar/ledgerly_canonical_owner}"},{"table":"canonical_journal_lines","owner":"ledgerly_canonical_owner","acl":"{ledgerly_canonical_owner=arwdDxt/ledgerly_canonical_owner,ledgerly_api=ar/ledgerly_canonical_owner}"},{"table":"canonical_journal_relations","owner":"ledgerly_canonical_owner","acl":"{ledgerly_canonical_owner=arwdDxt/ledgerly_canonical_owner,ledgerly_api=ar/ledgerly_canonical_owner}"}],"acl":{"schema":"{postgres=UC/postgres}"},"constraints":["accounting_audit_events_effect_fk","accounting_audit_events_journal_fk","accounting_audit_events_pkey","accounting_posting_effects_pkey","accounting_posting_effects_status_check","canonical_journal_entries_pkey","canonical_journal_entries_status_check","canonical_journal_entries_totals_check","canonical_journal_lines_account_fk","canonical_journal_lines_amounts_check","canonical_journal_lines_entry_fk","canonical_journal_lines_pkey","canonical_journal_relations_effect_fk","canonical_journal_relations_original_fk","canonical_journal_relations_pkey","canonical_journal_relations_related_fk","canonical_journal_relations_type_check"],"indexes":["accounting_posting_effects_company_effect_idx","accounting_posting_effects_company_idempotency_idx","accounting_posting_effects_company_source_idx","accounting_posting_effects_pkey"],"triggers":[{"name":"ledgerly_accounting_audit_events_guard","enabled":"A","table":"accounting_audit_events"},{"name":"ledgerly_accounting_posting_effects_guard","enabled":"A","table":"accounting_posting_effects"},{"name":"ledgerly_canonical_journal_entries_guard","enabled":"A","table":"canonical_journal_entries"},{"name":"ledgerly_canonical_journal_lines_guard","enabled":"A","table":"canonical_journal_lines"},{"name":"ledgerly_canonical_journal_relations_guard","enabled":"A","table":"canonical_journal_relations"}],"emptyBaseline":true,"privateBinding":true,"functions":[{"name":"ledgerly_canonical_append_only_guard","owner":"ledgerly_canonical_owner","searchPath":["search_path=pg_catalog, public"]},{"name":"ledgerly_canonical_journal_header_guard","owner":"ledgerly_canonical_owner","searchPath":["search_path=pg_catalog, public"]},{"name":"ledgerly_canonical_journal_line_guard","owner":"ledgerly_canonical_owner","searchPath":["search_path=pg_catalog, public"]},{"name":"ledgerly_posting_effect_transition_guard","owner":"ledgerly_canonical_owner","searchPath":["search_path=pg_catalog, public"]},{"name":"ledgerly_verify_disposable_run","owner":"postgres","searchPath":["search_path=pg_catalog, ledgerly_test_control"]},{"name":"ledgerly_verify_external_disposable_run","owner":"postgres","searchPath":["search_path=pg_catalog, ledgerly_test_control"]}],"memberships":0,"schemaPush":{"recoveredOrdering":true,"pushes":2},"relationForeignKeys":[{"name":"accounting_audit_events_effect_fk","validated":true},{"name":"accounting_audit_events_journal_fk","validated":true},{"name":"canonical_journal_lines_account_fk","validated":true},{"name":"canonical_journal_lines_entry_fk","validated":true},{"name":"canonical_journal_relations_effect_fk","validated":true},{"name":"canonical_journal_relations_original_fk","validated":true},{"name":"canonical_journal_relations_related_fk","validated":true}],"journalLock":{"owner":"ledgerly_canonical_owner","securityDefiner":true,"volatile":true,"searchPath":["search_path=pg_catalog, pg_temp"],"apiExecute":true,"publicExecute":false,"apiUpdate":false,"apiDelete":false,"apiTruncate":false}},"runtime":{"databaseName":"ledgerly_canonical_test_283124e147d44754ae97e0f59c2f579e","currentUser":"ledgerly_api","sessionUser":"ledgerly_api","identityVerified":true,"privateBindingVerified":true,"sourceDigestsVerified":true,"concurrencyEvidence":{"expected":2,"arrivals":[{"backendPid":179,"transactionId":"891","arrivedAt":1792520516844},{"backendPid":180,"transactionId":"892","arrivedAt":1792520516850}],"releasedAt":1792520516850,"overlapProven":true},"testIdentity":{"runId":"283124e1-47d4-4754-ae97-e0f59c2f579e","databaseName":"ledgerly_canonical_test_283124e147d44754ae97e0f59c2f579e","currentUser":"ledgerly_api","triggerState":"ENABLE ALWAYS","emptyCanonicalBaseline":true,"externalCi":true},"negativePrivilegeEvidence":{"roleEscalationDenied":true,"setRolePostgresDenied":true,"triggerDisableDenied":true,"canonicalDeleteDenied":true},"journalLockEvidence":{"functionOwner":"ledgerly_canonical_owner","callerHasUpdate":false,"scopedLookupsRejected":true,"directMutationDenied":true,"temporaryShadowRejected":true,"transactionalRowLockProven":true,"backendPids":[186,187]}},"negativeControls":{"missingRunBinding":true,"forgedRunDatabaseMismatch":true,"malformedUri":true,"targetChangingQuery":true,"wrongHost":true,"wrongPort":true,"wrongDatabase":true,"wrongRole":true,"parentDatabaseUrl":true,"replitMarker":true,"inheritedPgOverride":true,"unpinnedImage":true,"untrustedEvent":true,"unauthorizedWorkflow":true,"cleanupBindingMismatch":true,"evidenceCredentialPattern":true,"roleEscalation":true,"triggerDisable":true},"cleanup":{"logicalDrop":true,"databaseAbsent":true,"containerRemoved":true,"networkRemoved":true,"credentialMaterialRemoved":true},"isolation":{"parentDatabaseUrlAbsent":true,"replitVariablesAbsent":true,"noPublishedPorts":true,"internalNetwork":true,"testContainerNoSocket":true,"testContainerNoExternalRoute":true,"heliumdbContacted":false,"productionContacted":false,"secretScanPassed":true}}
